{
  "version": 1,
  "contract_version": 1,
  "wheel_version": "0.1.0",
  "fixture": "synthetic-ring-series-v1",
  "input_frame_count": 3,
  "pixel_to_micron": 0.4886,
  "source": "mib-processing-wheel-conformance",
  "frames": [
    {
      "frame_type": "valid",
      "index": 0,
      "timestamp_ns": 0,
      "object_id": 1,
      "object_count": 1,
      "track_id": 1,
      "track_first_frame": 0,
      "track_last_frame": 1,
      "track_observation_count": 2,
      "deformability": 0.009285212820575817,
      "area": 232.0,
      "area_um2": 55.38535072,
      "area_ratio": 1.0545454545454545,
      "ring_ratio": 31.304951684997057,
      "youngs_modulus": 0.0,
      "is_valid": true,
      "touches_border": false,
      "has_single_inner_contour": true,
      "in_range": true,
      "is_target_group": true,
      "inner_contour_count": 1,
      "brightness_q1": 255.0,
      "brightness_q2": 255.0,
      "brightness_q3": 255.0,
      "brightness_q4": 255.0,
      "mask_sha256": "8ce27f8776ff09d620f0cb1b075f3309d1971585aacd71309fcdf072d714589f",
      "series_images_sha256": [
        "8ce27f8776ff09d620f0cb1b075f3309d1971585aacd71309fcdf072d714589f",
        "71ffa7f6f3aecbaa17aa80b0c1fbcaadc99747fefff2faf3a5a7809d83f26d0c",
        "22dcbb5d3f81854f2b9223749edc617d3e90168e45427e938e80c219c3b26487"
      ]
    },
    {
      "frame_type": "invalid",
      "index": 2,
      "timestamp_ns": 0,
      "object_id": -1,
      "object_count": 0,
      "track_id": -1,
      "track_first_frame": 0,
      "track_last_frame": 0,
      "track_observation_count": 0,
      "deformability": 0.0,
      "area": 0.0,
      "area_um2": 0.0,
      "area_ratio": 0.0,
      "ring_ratio": 0.0,
      "youngs_modulus": 0.0,
      "is_valid": false,
      "touches_border": false,
      "has_single_inner_contour": false,
      "in_range": false,
      "is_target_group": false,
      "inner_contour_count": 0,
      "brightness_q1": 0.0,
      "brightness_q2": 0.0,
      "brightness_q3": 0.0,
      "brightness_q4": 0.0,
      "mask_sha256": "22dcbb5d3f81854f2b9223749edc617d3e90168e45427e938e80c219c3b26487",
      "series_images_sha256": []
    }
  ]
}
